name,price,url
Люстра Ливсден Brown,22 090,/irkutsk/product/lyustra-livsden-brown
Подвесной светильник Ливсден Brown,5190,/irkutsk/product/podvesnoj-svetilnik-livsden-brown
Настольная лампа Ливсден Brown,9090,/irkutsk/product/nastolnaya-lampa-livsden-brown
Торшер Ливсден Brown,14 290,/irkutsk/product/torsher-livsden-brown
Бра Флиммер Black,2200,/irkutsk/product/bra-flimmer-black
Люстра Флиммер Black,9090,/irkutsk/product/lyustra-flimmer-black
Подвесной светильник Флиммер Black,2460,/irkutsk/product/podvesnoj-svetilnik-flimmer-black
Настольная лампа Флиммер Black,3890,/irkutsk/product/nastolnaya-lampa-flimmer-black
Торшер Флиммер Black,5970,/irkutsk/product/torsher-flimmer-black
Торшер Нидлс Khaki,19 490,/irkutsk/product/torsher-nidls-khaki
Настольная лампа Нидлс Raffia Beige,4800,/irkutsk/product/nastolnaya-lampa-nidls-raffia-beige
Люстра Гейза Black,12 990,/irkutsk/product/lyustra-gejza-black
Настольная лампа Гейза Black,5190,/irkutsk/product/nastolnaya-lampa-gejza-black
Настольная лампа Гейза Pink,5190,/irkutsk/product/nastolnaya-lampa-gejza-pink
Настольная лампа Гейза Blue,5190,/irkutsk/product/nastolnaya-lampa-gejza-blue
Настольная лампа Гейза Orange,5190,/irkutsk/product/nastolnaya-lampa-gejza-orange
Настольная лампа Алней Black,5190,/irkutsk/product/nastolnaya-lampa-alnej-black
Настольная лампа Алней Beige,5190,/irkutsk/product/nastolnaya-lampa-alnej-beige
Настольная лампа Алней Green,5190,/irkutsk/product/nastolnaya-lampa-alnej-green
Настольная лампа Алней Orange,4670,/irkutsk/product/nastolnaya-lampa-alnej-orange
Торшер Алней Green,9090,/irkutsk/product/torsher-alnej-green
Торшер Алней Black,9090,/irkutsk/product/torsher-alnej-black
Торшер Алней Orange,9090,/irkutsk/product/torsher-alnej-orange
Торшер Алней Beige,9090,/irkutsk/product/torsher-alnej-beige
Настольная лампа Арбет Orange,3110,/irkutsk/product/nastolnaya-lampa-arbet-orange
Настольная лампа Арбет Silver,3890,/irkutsk/product/nastolnaya-lampa-arbet-silver
Настольная лампа Арбет Beige,3110,/irkutsk/product/nastolnaya-lampa-arbet-beige
Настольная лампа Арбет White,3110,/irkutsk/product/nastolnaya-lampa-arbet-white
Настольная лампа Арбет Black,2590,/irkutsk/product/nastolnaya-lampa-arbet-black
Настольная лампа Синдри Grey,5190,/irkutsk/product/nastolnaya-lampa-sindri-grey
Люстра Синдри Black,18 190,/irkutsk/product/lyustra-sindri-black
Настольная лампа Манэт White,2980,/irkutsk/product/nastolnaya-lampa-manet-white
Настольная лампа Леррет Beige,4670,/irkutsk/product/nastolnaya-lampa-lerret-beige
Настольная лампа Леррет White,2980,/irkutsk/product/nastolnaya-lampa-lerret-white
Настольная лампа Истад Black,1810,/irkutsk/product/nastolnaya-lampa-istad-black
Настольная лампа Истад White,2200,/irkutsk/product/nastolnaya-lampa-istad-white
Люстра Боллар White,29 890,/irkutsk/product/lyustra-bollar-white
Настольная лампа Рибе Black,2460,/irkutsk/product/nastolnaya-lampa-ribe-black
Настольная лампа Рибе Orange,2460,/irkutsk/product/nastolnaya-lampa-ribe-orange
Настольная лампа Снибальд White,1030,/irkutsk/product/nastolnaya-lampa-snibald-white
Настольная лампа Спайк Pink,1290,/irkutsk/product/nastolnaya-lampa-spajk-pink
Настольная лампа Спайк White,1810,/irkutsk/product/nastolnaya-lampa-spajk-white
Настольная лампа Астри Black,1680,/irkutsk/product/nastolnaya-lampa-astri-black
Настольная лампа Астри Beige,1810,/irkutsk/product/nastolnaya-lampa-astri-beige
Подвесной светильник Клауд White,12 990,/irkutsk/product/podvesnoj-svetilnik-klaud-white
Торшер Клауд White,23 780,/irkutsk/product/torsher-klaud-white
Настольная лампа Клауд White,18 190,/irkutsk/product/nastolnaya-lampa-klaud-white
Настольная лампа Машрум Olive,4540,/irkutsk/product/nastolnaya-lampa-mashrum-olive
